<?xml version = "1.0" encoding = "UTF-8" standalone = "yes" ?>
<crew-configuration xmlns:xsi="http://www.w3.org/2001/XMLSchema-instance" xsi:noNamespaceSchemaLocation="crew.xsd"
		name="Founders" description="Project contributors">

	<!-- List of preconfigured crew  -->
	<crew-list>
	
		<person name="Manny Kung" 
			gender="male" 
			personality-type="ISTJ"
			country="United States"
			job="Botanist"
			favorite-main-dish="Bean Sprout Garlic Stir Fry"
			favorite-side-dish="Roasted Carrot Soup"
			favorite-dessert="strawberry"
			favorite-activity="Field Work">

			<personality-trait-list>
				<!-- the personality trait for a person using The Big Five Personality Traits, aka the Five Factor Model (FFM) -->
				<!--  name : the dimension (required) -->
				<!-- value : 0 (the absence of this trait) to 100 (the max presence of this trait) (required) -->
				<personality-trait name = "openness" 	value = "25"/>
				<personality-trait name = "conscientiousness"	 value = "65"/>
				<personality-trait name = "extraversion" 	value = "20"/>
				<personality-trait name = "agreeableness" 	value = "45"/>
				<personality-trait name = "neuroticism" 	value = "55"/>
			</personality-trait-list>

			<!-- List of configured natural attributes. (optional) -->
			<natural-attribute-list>
				<!-- A natural attribute for the person. -->
				<!-- name: the name of the attribute (required).-->
				<!-- value: 0 (low) to 100 (high) (required). -->
				<natural-attribute name="Strength" value="60"/>
				<natural-attribute name="Endurance" value="42"/>
				<natural-attribute name="Agility" value="71"/>
				<natural-attribute name="Teaching" value="65"/>
				<natural-attribute name="Academic Aptitude" value="70"/>
				<natural-attribute name="Experience Aptitude" value="35"/>
				<natural-attribute name="Stress Resilience" value="43"/>
				<natural-attribute name="Attractiveness" value="67"/>
				<natural-attribute name="Leadership" value="25"/>
				<natural-attribute name="Conversation" value="80"/>
			</natural-attribute-list>

			<!-- List of configured skills. (optional) -->
			<skill-list>
				<!-- A skill for the person. See the list in SkillType class. -->
				<!--  name : the name of the skill. (required). -->
				<!-- level : the level of the skill ( >= 0 ) (required). -->
				<skill name="Botany" level="2"/>
				<skill name="Mechanics" level="1"/>
				<skill name="EVA Operations" level="1"/>
				<skill name="Areology" level="1"/>
				<skill name="Medicine" level="1"/>
				<skill name="Cooking" level="1"/>
			</skill-list>
		</person>

		<person name="Lars Christensen" 
			gender="male" 
			personality-type="ESTP"
			country="Denmark"
			job="Areologist"
			favorite-main-dish="Salsa Potato Salad" 
			favorite-side-dish="Sesame Miso Soup" 
			favorite-dessert="Soymilk"
			favorite-activity="Operation">
			<personality-trait-list>
				<personality-trait name = "openness"	 value = "35"/>
				<personality-trait name = "conscientiousness"	 value = "60"/>
				<personality-trait name = "extraversion" 	value = "80"/>
				<personality-trait name = "agreeableness" 	value = "55"/>
				<personality-trait name = "neuroticism" 	value = "45"/>
			</personality-trait-list>
			<skill-list>
                <skill name="Piloting" level="1"/>
                <skill name="Physics" level="1"/>
                <skill name="Botany" level="1"/>
                <skill name="Trading" level="1"/>
                <skill name="EVA Operations" level="1"/>
                <skill name="Cooking" level="2"/>
            </skill-list>
       </person>

        <person name="Scott Davis" 
        	gender="male" 
        	personality-type="INFJ"
			country="United States"
        	job="Engineer"
			favorite-main-dish="Steamed Brown Rice" 
			favorite-side-dish="Roasted Carrot Soup" 
			favorite-dessert="Cranberry Juice"
			favorite-activity="Research">
			<personality-trait-list>
				<personality-trait name = "openness" 	value = "65"/>
				<personality-trait name = "conscientiousness" 	value = "80"/>
				<personality-trait name = "extraversion" 	value = "15"/>
				<personality-trait name = "agreeableness" 	value = "75"/>
				<personality-trait name = "neuroticism" 	value = "75"/>
			</personality-trait-list>
            <skill-list>
                <skill name="Physics" level="1"/>
                <skill name="Botany" level="1"/>
                <skill name="Mechanics" level="1"/>
                <skill name="Areology" level="1"/>
                <skill name="Medicine" level="1"/>
                <skill name="Materials Science" level="2"/>
            </skill-list>
        </person>

        <person name="Dennis Krenz" 
        	gender="male" 
        	personality-type="ENFJ"
			country="Germany"
        	job="Technician"
			favorite-main-dish="Kidney Bean Fried Rice" 
			favorite-side-dish="Garlic Bread" 
			favorite-dessert="Blueberry Muffin"
			favorite-activity="Tinkering">
			<personality-trait-list>
				<personality-trait name = "openness" 	value = "70"/>
				<personality-trait name = "conscientiousness" 	value = "60"/>
				<personality-trait name = "extraversion" 	value = "85"/>
				<personality-trait name = "agreeableness" 	value = "80"/>
				<personality-trait name = "neuroticism" 	value = "35"/>
			</personality-trait-list>
            <skill-list>
                <skill name="Piloting" level="1"/>
                <skill name="Physics" level="1"/>
                <skill name="Botany" level="1"/>
                <skill name="Mechanics" level="2"/>
                <skill name="EVA Operations" level="1"/>
                <skill name="Materials Science" level="1"/>
            </skill-list>
        </person>

       <person name="Barry Evans" 
       		gender="male" 
       		personality-type="INTP"
			country="United Kingdom"
        	job="Doctor"
			favorite-main-dish="Veggie Sandwich" 
			favorite-side-dish="Taro Soup"
			favorite-dessert="Soymilk"
			favorite-activity="Astronomy">
			<personality-trait-list>
				<personality-trait name = "openness" 	value = "80"/>
				<personality-trait name = "conscientiousness" 	value = "90"/>
				<personality-trait name = "extraversion" 	value = "35"/>
				<personality-trait name = "agreeableness" 	value = "70"/>
				<personality-trait name = "neuroticism" 	value = "20"/>
			</personality-trait-list>
            <skill-list>
                <skill name="Reporting" level="1"/>
                <skill name="Physics" level="1"/>
                <skill name="Medicine" level="2"/>
                <skill name="Astronomy" level="1"/>
                <skill name="Materials Science" level="1"/>
            </skill-list>
        </person>
        
	</crew-list>

</crew-configuration>
